,Number,Days,Date,"Morning

08:00am 09:00am 10:00am 11:00am","Afternoon

11:30am 12:30pm 01:30pm 02:30pm","Evening

03:00pm 04:00pm 05:00pm 06:00pm"
0,1,Friday,16 09 2022,MTE506 CPE401 MTE100 MTE306 EEE302 MEE504 ,CPE105 MTE207 CPE302 MTE304 EEE106 EEE305 ,CVE302 CPE305 CPE200 CVE100 MTE406 MTE109 
1,2,Saturday,17 09 2022,EEE501 CPE402 CPE201 CPE509 CVE404 MEE307 ,CPE102 CPE304 CVE304 MTE301 EEE309 MEE109 ,MTE408 MEE408 MEE201 MEE409 CVE401 CVE209 
2,3,Monday,19 09 2022,MEE401 MTE409 MTE103 MTE401 CVE403 EEE400 ,MTE201 EEE403 MEE500 MTE202 MEE305 CVE204 ,CVE400 MTE208 CVE402 EEE209 CVE201 CVE205 
3,4,Tuesday,20 09 2022,MTE102 EEE500 MEE100 CVE200 MEE104 EEE307 ,CVE207 MEE105 EEE507 CVE208 EEE509 MEE502 ,CPE507 CPE107 CVE101 CVE104 CVE500 MTE303 
4,5,Wednesday,21 09 2022,MEE508 EEE402 MEE200 EEE205 CPE206 MEE108 ,MEE308 EEE502 MTE505 EEE208 CPE109 MTE502 ,CPE108 EEE306 EEE303 MEE507 EEE401 MEE205 
5,6,Thursday,22 09 2022,MEE103 MTE108 EEE304 CPE506 MEE309 EEE102 ,MTE307 EEE301 CVE203 CPE209 MTE509 EEE407 ,CVE301 EEE504 CVE108 CPE204 MEE207 MTE209 
6,7,Friday,23 09 2022,CVE107 CVE406 CVE306 CPE403 MEE505 CVE506 ,EEE508 MEE204 EEE308 CVE109 CPE205 CPE101 ,MEE101 CPE202 MEE102 MTE400 MEE304 CVE106 
7,8,Saturday,24 09 2022,MEE300 MEE106 EEE107 MTE503 EEE406 CPE207 ,EEE503 MEE405 EEE108 MEE503 CPE106 CPE409 ,MTE206 EEE404 MEE209 MEE509 CPE104 MEE403 
8,9,Monday,26 09 2022,MTE507 CPE208 CPE103 EEE104 MTE104 CPE308 ,EEE202 EEE103 MTE504 MEE203 CPE407 CPE309 ,EEE204 EEE100 CVE509 CVE103 MTE205 MTE508 
9,10,Tuesday,27 09 2022,EEE408 MTE402 CVE409 CVE507 MEE404 CPE504 ,MTE300 EEE505 CVE206 CVE407 CPE505 MTE308 ,CPE303 CVE105 MEE400 CVE503 MTE302 CPE301 
10,11,Wednesday,28 09 2022,CVE303 EEE506 MEE202 CPE300 CPE501 CPE500 ,CVE308 CVE504 CPE406 CVE309 CPE503 CVE307 ,MTE500 CVE502 MTE403 MEE208 CPE203 CVE508 
11,12,Thursday,29 09 2022,CVE102 MTE101 MTE501 EEE200 EEE206 EEE109 ,MTE200 CVE408 EEE105 CPE502 MTE305 MEE501 ,CVE405 MEE402 CPE405 EEE405 MEE406 CPE100 
12,13,Friday,30 09 2022,MEE306 CPE408 MTE407 MTE105 CPE306 MTE203 ,CVE501 CVE300 MTE107 MEE107 EEE409 MEE206 ,MTE404 EEE101 MEE301 CPE307 CVE202 MEE302 
13,14,Saturday,01 10 2022,CVE505 MEE407 EEE207 MTE204 MTE405 MTE106 ,CVE305 MEE303 EEE201 CPE400 MTE309 EEE203 ,EEE300 MEE506 CPE508 CPE404 
